{
  "$schema": "https://json-schema.org/draft/2020-12/schema",
  "properties": {
    "nome": {
      "type": "string"
    },
    "chaveI18N": {
      "type": "string"
    },
    "exigeAbaExclusiva": {
      "type": "boolean"
    },
    "elementos": {
      "type": "array",
      "items": {
        "type": "object",
        "properties": {
          "nome": {
            "type": "string"
          },
          "tipo": {
            "type": "string"
          },
          "chaveI18N": {
            "type": "string"
          }
        },
        "required": ["nome", "tipo", "chaveI18N"]
      }
    }
  },
  "required": ["nome", "chaveI18N", "exigeAbaExclusiva", "elementos"]
}
