{
  "$schema": ".diagrama.schema.json",
  "nome": "Diagrama Entidade Relacionamento",
  "chaveI18N": "diagram.entity.title",
  "exigeAbaExclusiva": false,
  "elementos": [
    {
      "nome": "agregação",
      "tipo": "agregacao",
      "chaveI18N": "element.aggregation"
    },
    {
      "nome": "atributo",
      "tipo": "atributo_der",
      "chaveI18N": "element.entity-attribute"
    },
    {
      "nome": "entidade",
      "tipo": "entidade",
      "chaveI18N": "element.entity"
    },
    {
      "nome": "especialização",
      "tipo": "especializacao",
      "chaveI18N": "element.specialization"
    },
    {
      "nome": "nota",
      "tipo": "nota",
      "chaveI18N": "element.note"
    },
    {
      "nome": "relacionamento",
      "tipo": "relacionamento",
      "chaveI18N": "element.relationship"
    },
    {
      "nome": "texto",
      "tipo": "texto",
      "chaveI18N": "element.text"
    }
  ]
}
