{
  "$schema": ".diagrama.schema.json",
  "nome": "Dicionário de Dados",
  "chaveI18N": "diagram.dictionary.title",
  "exigeAbaExclusiva": true,
  "elementos": [
    {
      "nome": "Tabela Dicionário de Dados",
      "tipo": "tabela_dicionario",
      "chaveI18N": "element.dictionary-table"
    }
  ]
}
