{
  "$schema": ".diagrama.schema.json",
  "nome": "Diagrama do Modelo Relacional",
  "chaveI18N": "diagram.relational.title",
  "exigeAbaExclusiva": false,
  "elementos": [
    {
      "nome": "tabela",
      "tipo": "tabela_relacional",
      "chaveI18N": "element.relational-table"
    },
    {
      "nome": "cardinalidade",
      "tipo": "cardinalidade",
      "chaveI18N": "element.entity-cardinality"
    },
    {
      "nome": "nota",
      "tipo": "nota",
      "chaveI18N": "element.note"
    },
    {
      "nome": "texto",
      "tipo": "texto",
      "chaveI18N": "element.text"
    }
  ]
}
